<?xml version="1.0" ?>

<root xmlns:xsi="http://www.w3.org/2001/XMLSchema-instance"
      xsi:noNamespaceSchemaLocation='test.xsd' >
  <my_string>
    <size>10</size>
    <contents>ManuManuMa</contents>
  </my_string>

  <zip>
    <zipcode>1723</zipcode>
  </zip>

  <zip attr1="val" attr3="value1" attr4="value1">
    <code_postal>1723</code_postal>
  </zip>

  <zip>
    <zipcode>1723</zipcode>
    <!--  <zipcode>1724</zipcode> -->
  </zip>

  <strs>
     <str>a</str>
     <str2>b</str2>
     <str>c</str>
  </strs>

  <strs>
     <str>a</str>
     <str2>b</str2>
     <str>c</str>
  </strs>

  <strs>
     <str>a</str>
     <str2>b</str2>
     <str>c</str>
  </strs>

  <!-- Invalid
  <strs2>
     <str>a</str>
     <str2>b</str2>
     <str3>c</str3>
  </strs2>
  -->

  <xsi:manu/>

</root>
